{
  "contractType":"diagnostic-report","schemaVersion":"1.0.0","reportProfile":"DIAGNOSIS_ONLY","reportId":"REPORT-APM-16557989-R2","revision":2,"supersedesReportId":"REPORT-APM-16557989-R1","changeReasons":["ALARM_LIFECYCLE_RECOVERED"],
  "identity":{"incidentId":"APM-16557989","investigationId":"INV-APM-16557989","runId":"RUN-APM-16557989-1"},"target":{"provider":"HUAWEI_CLOUD","region":"cn-north-9","resourceType":"APM_INSTANCE","resourceId":"instance-2121291","displayName":"DPBinMedService/china2023-dpframework"},"incidentWindow":{"from":"2026-08-15T03:56:55Z","to":"2026-08-15T04:01:55Z"},
  "timeline":[{"itemId":"TIME-ALERT","at":"2026-08-15T03:56:55Z","stateCode":"ALERT","summary":"APM event 16557989 became active"},{"itemId":"TIME-RECOVER","at":"2026-08-15T04:01:55Z","stateCode":"RECOVER","summary":"The same APM event recovered after Eden collection"}],
  "observations":[{"itemId":"OBS-CODECACHE-LOW","claimType":"OBSERVATION","summary":"True Code Cache remained about 90.37 MiB of 256 MiB, approximately 35.30 percent","confidenceBasisPoints":10000,"supportingEvidenceRefs":["EVID-CODECACHE"],"contradictingEvidenceRefs":[]},{"itemId":"OBS-EDEN-GC","claimType":"OBSERVATION","summary":"Par Eden Space fell from about 4886.61 MiB to 103.20 MiB after the recovery point","confidenceBasisPoints":10000,"supportingEvidenceRefs":["EVID-EDEN"],"contradictingEvidenceRefs":[]},{"itemId":"OBS-EDEN-MATCH","claimType":"OBSERVATION","summary":"Alarm used 4874852480 and max 5154013184 match Par Eden Space byte-for-byte","confidenceBasisPoints":10000,"supportingEvidenceRefs":["EVID-EDEN"],"contradictingEvidenceRefs":[]}],
  "hypotheses":[{"itemId":"HYP-TEMPLATE-FILTER","claimType":"HYPOTHESIS","summary":"The alarm template lacks the effective memoryPool.name Code Cache filter or binds Eden directly","confidenceBasisPoints":9500,"supportingEvidenceRefs":["EVID-EDEN","EVID-CODECACHE"],"contradictingEvidenceRefs":[]}],"conclusions":[{"itemId":"CON-TEMPLATE-MISMATCH","claimType":"CONCLUSION","summary":"The CodeCache label is a template metric mismatch; the triggered series is Par Eden Space","confidenceBasisPoints":9500,"supportingEvidenceRefs":["EVID-EDEN","EVID-CODECACHE"],"contradictingEvidenceRefs":[],"disposition":"CONFIRMED"}],
  "evidenceReferences":[{"evidenceId":"EVID-CODECACHE","sourceCapability":"APM_TREND","sourceAdapter":"huawei-apm-v1","artifactRef":"apm-trend-codecache-16557989","sha256":"aaaaaaaaaaaaaaaaaaaaaaaaaaaaaaaaaaaaaaaaaaaaaaaaaaaaaaaaaaaaaaaa","collectedAt":"2026-08-25T02:00:00Z","window":{"from":"2026-08-15T03:40:00Z","to":"2026-08-15T04:15:00Z"},"targetResourceId":"instance-2121291","sensitivity":"CONTROLLED","redaction":"NONE"},{"evidenceId":"EVID-EDEN","sourceCapability":"APM_TREND","sourceAdapter":"huawei-apm-v1","artifactRef":"apm-trend-eden-16557989","sha256":"bbbbbbbbbbbbbbbbbbbbbbbbbbbbbbbbbbbbbbbbbbbbbbbbbbbbbbbbbbbbbbbb","collectedAt":"2026-08-25T02:00:00Z","window":{"from":"2026-08-15T03:40:00Z","to":"2026-08-15T04:15:00Z"},"targetResourceId":"instance-2121291","sensitivity":"CONTROLLED","redaction":"NONE"}],"gapCodes":[],"recommendations":[{"itemId":"REC-CHECK-TEMPLATE","summary":"Inspect template 8465 and rule 17680 memory-pool filtering; do not resize CodeCache or restart for this event","supportingEvidenceRefs":["EVID-EDEN","EVID-CODECACHE"],"safetyCode":"HUMAN_REVIEW_REQUIRED","executionState":"ADVISORY_ONLY"}],"evaluation":{"outcome":"NOT_REQUIRED","lineage":{},"judges":[]},"provenance":[{"componentId":"DPOMAgent","componentVersion":"1.0.0","contractVersion":"diagnosis-event-v2","sourceDigest":"dddddddddddddddddddddddddddddddddddddddddddddddddddddddddddddddd"}],"generatedAt":"2026-08-25T02:10:00Z","completeness":"COMPLETE","extensions":{"provider.huawei.apm@1":{"alarmId":16557989,"templateId":8465,"alarmRuleId":17680,"collector":"JVM","limitation":"Template edit-page configuration was not dereferenced"}},"reportDigest":"dd08ad6203a1ffe20c57588c3c4f6571c654baca15fe727ba5282773df6037cc"
}
