{
  "contractType":"diagnostic-report","schemaVersion":"1.0.0","reportProfile":"DIAGNOSIS_EVALUATED","reportId":"REPORT-EVAL-PASS","revision":1,"supersedesReportId":null,"changeReasons":[],
  "identity":{"incidentId":"INC-001","investigationId":"INV-001","runId":"RUN-001"},"target":{"provider":"HUAWEI_CLOUD","region":"cn-north-9","resourceType":"APM_INSTANCE","resourceId":"instance-2121291","displayName":"DPBinMedService"},"incidentWindow":{"from":"2026-08-15T03:56:55Z","to":"2026-08-15T04:01:55Z"},
  "timeline":[{"itemId":"TIME-001","at":"2026-08-15T03:56:55Z","stateCode":"ALERT","summary":"Alarm became active"}],"observations":[{"itemId":"OBS-001","claimType":"OBSERVATION","summary":"Eden values match the alarm payload","confidenceBasisPoints":10000,"supportingEvidenceRefs":["EVID-001"],"contradictingEvidenceRefs":[]}],"hypotheses":[],"conclusions":[{"itemId":"CON-001","claimType":"CONCLUSION","summary":"Alarm template selected Eden instead of CodeCache","confidenceBasisPoints":9500,"supportingEvidenceRefs":["EVID-001"],"contradictingEvidenceRefs":[],"disposition":"CONFIRMED"}],
  "evidenceReferences":[{"evidenceId":"EVID-001","sourceCapability":"APM_TREND","sourceAdapter":"huawei-apm-v1","artifactRef":"artifact-001","sha256":"aaaaaaaaaaaaaaaaaaaaaaaaaaaaaaaaaaaaaaaaaaaaaaaaaaaaaaaaaaaaaaaa","collectedAt":"2026-08-25T02:00:00Z","window":{"from":"2026-08-15T03:40:00Z","to":"2026-08-15T04:15:00Z"},"targetResourceId":"instance-2121291","sensitivity":"CONTROLLED","redaction":"NONE"}],"gapCodes":[],"recommendations":[{"itemId":"REC-001","summary":"Review the memory-pool filter","supportingEvidenceRefs":["EVID-001"],"safetyCode":"HUMAN_REVIEW_REQUIRED","executionState":"ADVISORY_ONLY"}],
  "evaluation":{"outcome":"PASS","lineage":{"evalCaseId":"CASE-001","evalRunId":"EVAL-RUN-001","suiteId":"SUITE-001","suiteVersion":"1.0.0","diagnosisSourceDigest":"dddddddddddddddddddddddddddddddddddddddddddddddddddddddddddddddd"},"judges":[
    {"judgeResultId":"JR-1","kind":"ROOT_CAUSE_CORRECTNESS","judgeId":"root-cause","judgeVersion":"1.0.0","status":"PASS","inputDigest":"eeeeeeeeeeeeeeeeeeeeeeeeeeeeeeeeeeeeeeeeeeeeeeeeeeeeeeeeeeeeeeee"},{"judgeResultId":"JR-2","kind":"EVIDENCE_SUFFICIENCY","judgeId":"evidence","judgeVersion":"1.0.0","status":"PASS","inputDigest":"eeeeeeeeeeeeeeeeeeeeeeeeeeeeeeeeeeeeeeeeeeeeeeeeeeeeeeeeeeeeeeee"},{"judgeResultId":"JR-3","kind":"TIMELINE_CONSISTENCY","judgeId":"timeline","judgeVersion":"1.0.0","status":"PASS","inputDigest":"eeeeeeeeeeeeeeeeeeeeeeeeeeeeeeeeeeeeeeeeeeeeeeeeeeeeeeeeeeeeeeee"},{"judgeResultId":"JR-4","kind":"RECOMMENDATION_SAFETY","judgeId":"safety","judgeVersion":"1.0.0","status":"PASS","inputDigest":"eeeeeeeeeeeeeeeeeeeeeeeeeeeeeeeeeeeeeeeeeeeeeeeeeeeeeeeeeeeeeeee"},{"judgeResultId":"JR-5","kind":"RULE_INVARIANTS","judgeId":"rules","judgeVersion":"1.0.0","status":"PASS","inputDigest":"eeeeeeeeeeeeeeeeeeeeeeeeeeeeeeeeeeeeeeeeeeeeeeeeeeeeeeeeeeeeeeee"},{"judgeResultId":"JR-6","kind":"SCHEMA_INTEGRITY","judgeId":"schema","judgeVersion":"1.0.0","status":"PASS","inputDigest":"eeeeeeeeeeeeeeeeeeeeeeeeeeeeeeeeeeeeeeeeeeeeeeeeeeeeeeeeeeeeeeee"}]},
  "provenance":[{"componentId":"DPOMAgent","componentVersion":"1.0.0","contractVersion":"diagnostic-report-v1","sourceDigest":"dddddddddddddddddddddddddddddddddddddddddddddddddddddddddddddddd"},{"componentId":"SREIntelligenceService","componentVersion":"1.0.0","contractVersion":"evaluation-suite-v1","sourceDigest":"ffffffffffffffffffffffffffffffffffffffffffffffffffffffffffffffff"}],"generatedAt":"2026-08-25T02:05:00Z","completeness":"COMPLETE","extensions":{},"reportDigest":"e128641aec6cc28a62880f95543302c8bf11cde4fda43ab9e2fe900c75a97ef4"
}
