{
  "contractType":"diagnostic-report","schemaVersion":"1.0.0","reportProfile":"DIAGNOSIS_EVALUATED","reportId":"REPORT-EVAL-INCOMPLETE","revision":1,"supersedesReportId":null,"changeReasons":[],"identity":{"incidentId":"INC-004","investigationId":"INV-004","runId":"RUN-004"},"target":{"provider":"HUAWEI_CLOUD","region":"cn-north-9","resourceType":"APM_INSTANCE","resourceId":"instance-4","displayName":"service-4"},"incidentWindow":{"from":"2026-08-15T03:00:00Z","to":"2026-08-15T04:00:00Z"},"timeline":[{"itemId":"TIME-4","at":"2026-08-15T03:00:00Z","stateCode":"ALERT","summary":"Alarm active"}],"observations":[{"itemId":"OBS-4","claimType":"OBSERVATION","summary":"Bounded observation","confidenceBasisPoints":9000,"supportingEvidenceRefs":["EVID-4"],"contradictingEvidenceRefs":[]}],"hypotheses":[],"conclusions":[{"itemId":"CON-4","claimType":"CONCLUSION","summary":"Evaluation is not complete","confidenceBasisPoints":5000,"supportingEvidenceRefs":["EVID-4"],"contradictingEvidenceRefs":[],"disposition":"HYPOTHESIS"}],"evidenceReferences":[{"evidenceId":"EVID-4","sourceCapability":"APM_TREND","sourceAdapter":"huawei-apm-v1","artifactRef":"artifact-4","sha256":"aaaaaaaaaaaaaaaaaaaaaaaaaaaaaaaaaaaaaaaaaaaaaaaaaaaaaaaaaaaaaaaa","collectedAt":"2026-08-25T02:00:00Z","window":{"from":"2026-08-15T03:00:00Z","to":"2026-08-15T04:00:00Z"},"targetResourceId":"instance-4","sensitivity":"CONTROLLED","redaction":"NONE"}],"gapCodes":["UNAVAILABLE_JUDGE"],"recommendations":[],"evaluation":{"outcome":"INCOMPLETE","lineage":{"evalCaseId":"CASE-4","evalRunId":"EVAL-RUN-4","suiteId":"SUITE-1","suiteVersion":"1.0.0","diagnosisSourceDigest":"dddddddddddddddddddddddddddddddddddddddddddddddddddddddddddddddd"},"judges":[{"judgeResultId":"JR-I1","kind":"ROOT_CAUSE_CORRECTNESS","judgeId":"root-cause","judgeVersion":"1.0.0","status":"PASS","inputDigest":"eeeeeeeeeeeeeeeeeeeeeeeeeeeeeeeeeeeeeeeeeeeeeeeeeeeeeeeeeeeeeeee"},{"judgeResultId":"JR-I2","kind":"EVIDENCE_SUFFICIENCY","judgeId":"evidence","judgeVersion":"1.0.0","status":"UNAVAILABLE","inputDigest":"eeeeeeeeeeeeeeeeeeeeeeeeeeeeeeeeeeeeeeeeeeeeeeeeeeeeeeeeeeeeeeee"}]},"provenance":[{"componentId":"SREIntelligenceService","componentVersion":"1.0.0","contractVersion":"diagnostic-report-v1","sourceDigest":"ffffffffffffffffffffffffffffffffffffffffffffffffffffffffffffffff"}],"generatedAt":"2026-08-25T02:05:00Z","completeness":"INCOMPLETE","extensions":{},"reportDigest":"cd399a471ec9938a7d03d60554f1adf3bd4f65bbb3ddeb358574993647ed42f2"
}
